{
  "schemaVersion": 1,
  "kind": "dustin-close-report",
  "network": {
    "passphrase": "Test SDF Network ; September 2015",
    "horizon": "https://horizon-testnet.stellar.org"
  },
  "account": "GBLXGTTPY2ZU64A53ZCANIX7ZFLXMHI6KSGRCPKSY5ORZAFEHUU3YMOK",
  "destination": "GBR3YSAJB5V75OA377G54DABNPO65I5IUHUW24C7QFFDOD2DDER42UJQ",
  "feeSponsor": "GCBW3VNCN7IYREOZIJ7LFC5TCRK3O6E4K7TK3WGY2KK6AARIOYFC6O6I",
  "planHash": "b9e605ac8eeca18663f9873a465e0f044d140416c97d9d9ffd878b89d1f06065",
  "links": {
    "account": {
      "explorer": "https://stellar.expert/explorer/testnet/account/GBLXGTTPY2ZU64A53ZCANIX7ZFLXMHI6KSGRCPKSY5ORZAFEHUU3YMOK",
      "horizon": "https://horizon-testnet.stellar.org/accounts/GBLXGTTPY2ZU64A53ZCANIX7ZFLXMHI6KSGRCPKSY5ORZAFEHUU3YMOK"
    },
    "destination": {
      "explorer": "https://stellar.expert/explorer/testnet/account/GBR3YSAJB5V75OA377G54DABNPO65I5IUHUW24C7QFFDOD2DDER42UJQ",
      "horizon": "https://horizon-testnet.stellar.org/accounts/GBR3YSAJB5V75OA377G54DABNPO65I5IUHUW24C7QFFDOD2DDER42UJQ"
    }
  },
  "status": "closed",
  "message": null,
  "stop": null,
  "startedAt": "2026-10-12T14:27:53.382Z",
  "finishedAt": "2026-10-12T14:28:07.612Z",
  "transactions": [
    {
      "index": 0,
      "phase": "cleanup",
      "stepIds": [
        "S01",
        "S02",
        "S03",
        "S04",
        "S05",
        "S06",
        "S07",
        "S08",
        "S09"
      ],
      "attempts": 1,
      "attempt": 1,
      "round": 0,
      "sequence": "22154841472106501",
      "baseFeeStroops": 42088,
      "maxTime": 1791815392,
      "hash": "c98a7c223818bbdb44e319dd8a45b162a9189d7d93fb1e11bdf1cf3e0c158e02",
      "innerHash": "58022a71be5f97a2263579c87252ae20429fd8ef6d66aafa0301305ab35843c3",
      "result": "applied",
      "ledger": 5158338,
      "feeChargedStroops": 1000,
      "feeAccount": "GCBW3VNCN7IYREOZIJ7LFC5TCRK3O6E4K7TK3WGY2KK6AARIOYFC6O6I",
      "innerEnvelopeXdr": "AAAAAgAAAABXc05vxrNPcB3eRAai/8lXdh0eVI0RPVLHXRyApD0pvAAAAAAATrW2AAAABQAAAAEAAAAAAAAAAAAAAABqzO7gAAAAAAAAAAkAAAAAAAAAAwAAAAJEVVNUQQAAAAAAAAAAAAAAu4JPT1Qf+wiQs5/ASCk9to6lulUZZ1YMoZ69Q9S/OPsAAAAAAAAAAAAAAAAAAABkAAAAAQAAAAAADevsAAAAAAAAAAMAAAACRFVTVEMAAAAAAAAAAAAAALuCT09UH/sIkLOfwEgpPbaOpbpVGWdWDKGevUPUvzj7AAAAAkRVU1RCAAAAAAAAAAAAAAC7gk9PVB/7CJCzn8BIKT22jqW6VRlnVgyhnr1D1L84+wAAAAAAAAAAAAAAAQAAAAEAAAAAAA3r7QAAAAAAAAABAAAAALuCT09UH/sIkLOfwEgpPbaOpbpVGWdWDKGevUPUvzj7AAAAAkRVU1RCAAAAAAAAAAAAAAC7gk9PVB/7CJCzn8BIKT22jqW6VRlnVgyhnr1D1L84+wAAAAAAAAADAAAAAAAAAAYAAAACRFVTVEIAAAAAAAAAAAAAALuCT09UH/sIkLOfwEgpPbaOpbpVGWdWDKGevUPUvzj7AAAAAAAAAAAAAAAAAAAAAQAAAAC7gk9PVB/7CJCzn8BIKT22jqW6VRlnVgyhnr1D1L84+wAAAAJEVVNUQwAAAAAAAAAAAAAAu4JPT1Qf+wiQs5/ASCk9to6lulUZZ1YMoZ69Q9S/OPsAAAAAAAAABQAAAAAAAAAGAAAAAkRVU1RDAAAAAAAAAAAAAAC7gk9PVB/7CJCzn8BIKT22jqW6VRlnVgyhnr1D1L84+wAAAAAAAAAAAAAAAAAAAAEAAAAAu4JPT1Qf+wiQs5/ASCk9to6lulUZZ1YMoZ69Q9S/OPsAAAABU1BUQQAAAAC7gk9PVB/7CJCzn8BIKT22jqW6VRlnVgyhnr1D1L84+wAAAAAAAAABAAAAAAAAAAYAAAABU1BUQQAAAAC7gk9PVB/7CJCzn8BIKT22jqW6VRlnVgyhnr1D1L84+wAAAAAAAAAAAAAAAAAAAAoAAAAOZHVzdGluLmZpeHR1cmUAAAAAAAAAAAAAAAAAAaQ9KbwAAABAOAmvIJbc4bzL1maxNJ6ARgML6s/+bv+DRZdHp39HMVymcg3PzgYzRl8ZtMInWFT/E7eZgzi2NFEbb6JZCmRZDA==",
      "feeBumpEnvelopeXdr": "AAAABQAAAACDbdWib9GIkdlCfrKLsxRVt3icV+at2NjSleACKHYKLwAAAAAABmwQAAAAAgAAAABXc05vxrNPcB3eRAai/8lXdh0eVI0RPVLHXRyApD0pvAAAAAAATrW2AAAABQAAAAEAAAAAAAAAAAAAAABqzO7gAAAAAAAAAAkAAAAAAAAAAwAAAAJEVVNUQQAAAAAAAAAAAAAAu4JPT1Qf+wiQs5/ASCk9to6lulUZZ1YMoZ69Q9S/OPsAAAAAAAAAAAAAAAAAAABkAAAAAQAAAAAADevsAAAAAAAAAAMAAAACRFVTVEMAAAAAAAAAAAAAALuCT09UH/sIkLOfwEgpPbaOpbpVGWdWDKGevUPUvzj7AAAAAkRVU1RCAAAAAAAAAAAAAAC7gk9PVB/7CJCzn8BIKT22jqW6VRlnVgyhnr1D1L84+wAAAAAAAAAAAAAAAQAAAAEAAAAAAA3r7QAAAAAAAAABAAAAALuCT09UH/sIkLOfwEgpPbaOpbpVGWdWDKGevUPUvzj7AAAAAkRVU1RCAAAAAAAAAAAAAAC7gk9PVB/7CJCzn8BIKT22jqW6VRlnVgyhnr1D1L84+wAAAAAAAAADAAAAAAAAAAYAAAACRFVTVEIAAAAAAAAAAAAAALuCT09UH/sIkLOfwEgpPbaOpbpVGWdWDKGevUPUvzj7AAAAAAAAAAAAAAAAAAAAAQAAAAC7gk9PVB/7CJCzn8BIKT22jqW6VRlnVgyhnr1D1L84+wAAAAJEVVNUQwAAAAAAAAAAAAAAu4JPT1Qf+wiQs5/ASCk9to6lulUZZ1YMoZ69Q9S/OPsAAAAAAAAABQAAAAAAAAAGAAAAAkRVU1RDAAAAAAAAAAAAAAC7gk9PVB/7CJCzn8BIKT22jqW6VRlnVgyhnr1D1L84+wAAAAAAAAAAAAAAAAAAAAEAAAAAu4JPT1Qf+wiQs5/ASCk9to6lulUZZ1YMoZ69Q9S/OPsAAAABU1BUQQAAAAC7gk9PVB/7CJCzn8BIKT22jqW6VRlnVgyhnr1D1L84+wAAAAAAAAABAAAAAAAAAAYAAAABU1BUQQAAAAC7gk9PVB/7CJCzn8BIKT22jqW6VRlnVgyhnr1D1L84+wAAAAAAAAAAAAAAAAAAAAoAAAAOZHVzdGluLmZpeHR1cmUAAAAAAAAAAAAAAAAAAaQ9KbwAAABAOAmvIJbc4bzL1maxNJ6ARgML6s/+bv+DRZdHp39HMVymcg3PzgYzRl8ZtMInWFT/E7eZgzi2NFEbb6JZCmRZDAAAAAAAAAABKHYKLwAAAECKUWFoqSR+2bp8+d1RFP9/MqL5f1X8VK7Urixj+ai3s2gjW070/Ugr9Ty/BF8aO5W6ljUdSI8oLViBF05pRpEL",
      "explorerUrl": "https://stellar.expert/explorer/testnet/tx/c98a7c223818bbdb44e319dd8a45b162a9189d7d93fb1e11bdf1cf3e0c158e02",
      "horizonUrl": "https://horizon-testnet.stellar.org/transactions/c98a7c223818bbdb44e319dd8a45b162a9189d7d93fb1e11bdf1cf3e0c158e02",
      "operations": [
        {
          "stepId": "S01",
          "kind": "cancel_offer",
          "type": "manageSellOffer",
          "subject": "offer 912364",
          "offerId": "912364",
          "summary": "cancel offer 912364: sells 0.0000002 DUSTA for XLM"
        },
        {
          "stepId": "S02",
          "kind": "cancel_offer",
          "type": "manageSellOffer",
          "subject": "offer 912365",
          "offerId": "912365",
          "summary": "cancel offer 912365: sells 0.0000002 DUSTC for DUSTB"
        },
        {
          "stepId": "S03",
          "kind": "dispose_balance",
          "type": "payment",
          "subject": "trustline DUSTB:GC5YET2PKQP7WCEQWOP4ASBJHW3I5JN2KUMWOVQMUGPL2Q6UX44PW3EM",
          "asset": "DUSTB:GC5YET2PKQP7WCEQWOP4ASBJHW3I5JN2KUMWOVQMUGPL2Q6UX44PW3EM",
          "amount": "0.0000003",
          "rung": "return_to_issuer",
          "to": "GC5YET2PKQP7WCEQWOP4ASBJHW3I5JN2KUMWOVQMUGPL2Q6UX44PW3EM",
          "summary": "return 0.0000003 DUSTB to issuer GC5Y...W3EM (burn)"
        },
        {
          "stepId": "S04",
          "kind": "remove_trustline",
          "type": "changeTrust",
          "subject": "trustline DUSTB:GC5YET2PKQP7WCEQWOP4ASBJHW3I5JN2KUMWOVQMUGPL2Q6UX44PW3EM",
          "asset": "DUSTB:GC5YET2PKQP7WCEQWOP4ASBJHW3I5JN2KUMWOVQMUGPL2Q6UX44PW3EM",
          "summary": "remove trustline DUSTB"
        },
        {
          "stepId": "S05",
          "kind": "dispose_balance",
          "type": "payment",
          "subject": "trustline DUSTC:GC5YET2PKQP7WCEQWOP4ASBJHW3I5JN2KUMWOVQMUGPL2Q6UX44PW3EM",
          "asset": "DUSTC:GC5YET2PKQP7WCEQWOP4ASBJHW3I5JN2KUMWOVQMUGPL2Q6UX44PW3EM",
          "amount": "0.0000005",
          "rung": "return_to_issuer",
          "to": "GC5YET2PKQP7WCEQWOP4ASBJHW3I5JN2KUMWOVQMUGPL2Q6UX44PW3EM",
          "summary": "return 0.0000005 DUSTC to issuer GC5Y...W3EM (burn)"
        },
        {
          "stepId": "S06",
          "kind": "remove_trustline",
          "type": "changeTrust",
          "subject": "trustline DUSTC:GC5YET2PKQP7WCEQWOP4ASBJHW3I5JN2KUMWOVQMUGPL2Q6UX44PW3EM",
          "asset": "DUSTC:GC5YET2PKQP7WCEQWOP4ASBJHW3I5JN2KUMWOVQMUGPL2Q6UX44PW3EM",
          "summary": "remove trustline DUSTC"
        },
        {
          "stepId": "S07",
          "kind": "dispose_balance",
          "type": "payment",
          "subject": "trustline SPTA:GC5YET2PKQP7WCEQWOP4ASBJHW3I5JN2KUMWOVQMUGPL2Q6UX44PW3EM",
          "asset": "SPTA:GC5YET2PKQP7WCEQWOP4ASBJHW3I5JN2KUMWOVQMUGPL2Q6UX44PW3EM",
          "amount": "0.0000001",
          "rung": "return_to_issuer",
          "to": "GC5YET2PKQP7WCEQWOP4ASBJHW3I5JN2KUMWOVQMUGPL2Q6UX44PW3EM",
          "summary": "return 0.0000001 SPTA to issuer GC5Y...W3EM (burn)"
        },
        {
          "stepId": "S08",
          "kind": "remove_trustline",
          "type": "changeTrust",
          "subject": "trustline SPTA:GC5YET2PKQP7WCEQWOP4ASBJHW3I5JN2KUMWOVQMUGPL2Q6UX44PW3EM",
          "asset": "SPTA:GC5YET2PKQP7WCEQWOP4ASBJHW3I5JN2KUMWOVQMUGPL2Q6UX44PW3EM",
          "summary": "remove trustline SPTA (reserve sponsored by GCO7...SBP4)"
        },
        {
          "stepId": "S09",
          "kind": "remove_data",
          "type": "manageData",
          "subject": "data entry dustin.fixture",
          "dataName": "dustin.fixture",
          "summary": "delete data entry \"dustin.fixture\""
        }
      ]
    },
    {
      "index": 1,
      "phase": "convert",
      "stepIds": [
        "S10",
        "S11"
      ],
      "attempts": 1,
      "attempt": 1,
      "round": 0,
      "sequence": "22154841472106502",
      "baseFeeStroops": 42088,
      "maxTime": 1791815397,
      "hash": "96ed56d0fe972b8c7e64e1e11c442e8a5c99bb4cb27eaec170e08377a2e46138",
      "innerHash": "6a910e918b591c88e37b15ab248731f8f4552d999168210de9fe91e82653ef28",
      "result": "applied",
      "ledger": 5158339,
      "feeChargedStroops": 300,
      "feeAccount": "GCBW3VNCN7IYREOZIJ7LFC5TCRK3O6E4K7TK3WGY2KK6AARIOYFC6O6I",
      "innerEnvelopeXdr": "AAAAAgAAAABXc05vxrNPcB3eRAai/8lXdh0eVI0RPVLHXRyApD0pvAAAAAAATrW2AAAABgAAAAEAAAAAAAAAAAAAAABqzO7lAAAAAAAAAAIAAAAAAAAADQAAAAJEVVNUQQAAAAAAAAAAAAAAu4JPT1Qf+wiQs5/ASCk9to6lulUZZ1YMoZ69Q9S/OPsAAAAAAAAABwAAAABXc05vxrNPcB3eRAai/8lXdh0eVI0RPVLHXRyApD0pvAAAAAAAAAAAAAAABgAAAAAAAAAAAAAABgAAAAJEVVNUQQAAAAAAAAAAAAAAu4JPT1Qf+wiQs5/ASCk9to6lulUZZ1YMoZ69Q9S/OPsAAAAAAAAAAAAAAAAAAAABpD0pvAAAAEB8SyvyURNZKMRnlcACpCz+mkOiwW/ZSwiffJayoX6GQMhNHyfr3pFTxxHlan4vgd8aass/p8X8gDXGSI67tk0K",